<!ELEMENT esquis (esqui+)>
<!ELEMENT esqui (nom,talla,preu)>
<!ELEMENT nom (#PCDATA)>
<!ELEMENT talla (#PCDATA)>
<!ELEMENT preu (#PCDATA)>

<!ATTLIST esqui id ID #REQUIRED>